{
  "format_version": "1.2",
  "export_id": "EXP-ANON-004",
  "generated_at": "2026-09-10T19:56:32.133795+00:00",
  "detail_level": "full",
  "project_ref": "PRJ-e17173909848",
  "project_id": "anon-fixture",
  "framework_version": "0.7.0",
  "constitution_version": "1.4.0",
  "snapshot_sequence": 4,
  "summary": {
    "total": 9,
    "open": 8,
    "by_category": {
      "orchestration": 2,
      "permissions": 1,
      "tooling": 6
    },
    "by_origin": {
      "framework": 7,
      "human_process": 2
    },
    "by_severity": {
      "critical": 1,
      "high": 6,
      "medium": 2
    }
  },
  "observations": [
    {
      "constitution_version": "1.4.0",
      "revision": 1,
      "classification": {
        "origin": "framework",
        "confidence": "high"
      },
      "occurrence_count": 1,
      "framework_version": "0.7.0",
      "recorded_at": "2026-09-10T05:56:24.992472+00:00",
      "severity": "medium",
      "category": "orchestration",
      "last_recorded_at": "2026-09-10T05:56:24.992472+00:00",
      "impact": {
        "blocked_minutes": 0,
        "rework_required": false,
        "human_intervention": true,
        "affected_work_units": []
      },
      "work_unit": null,
      "recurrence_key": "REC-246fe034aa42",
      "id": "OBS-ad54c3a37039",
      "phase": "execution",
      "status": "candidate_change",
      "symptom": "[redacted]"
    },
    {
      "constitution_version": "1.4.0",
      "revision": 1,
      "classification": {
        "origin": "human_process",
        "confidence": "high"
      },
      "occurrence_count": 1,
      "framework_version": "0.7.0",
      "recorded_at": "2026-09-10T06:22:27.711732+00:00",
      "severity": "high",
      "category": "orchestration",
      "last_recorded_at": "2026-09-10T06:22:27.711732+00:00",
      "impact": {
        "blocked_minutes": 0,
        "rework_required": false,
        "human_intervention": true,
        "affected_work_units": [
          "WU-6fe0e4521f7a",
          "WU-2cbd31c47ec7"
        ]
      },
      "work_unit": null,
      "recurrence_key": "REC-12e00bcfbb13",
      "id": "OBS-ec3bd6965123",
      "phase": "execution",
      "status": "open",
      "symptom": "[redacted]"
    },
    {
      "constitution_version": "1.4.0",
      "revision": 1,
      "classification": {
        "origin": "framework",
        "confidence": "high"
      },
      "occurrence_count": 1,
      "framework_version": "0.7.0",
      "recorded_at": "2026-09-10T06:29:49.453678+00:00",
      "severity": "medium",
      "category": "tooling",
      "last_recorded_at": "2026-09-10T06:29:49.453678+00:00",
      "impact": {
        "blocked_minutes": 0,
        "rework_required": false,
        "human_intervention": false,
        "affected_work_units": []
      },
      "work_unit": null,
      "recurrence_key": "REC-b420f9884542",
      "id": "OBS-5b9539ed8dc4",
      "phase": "execution",
      "status": "candidate_change",
      "symptom": "[redacted]"
    },
    {
      "constitution_version": "1.4.0",
      "revision": 1,
      "classification": {
        "origin": "human_process",
        "confidence": "probable"
      },
      "occurrence_count": 1,
      "framework_version": "0.7.0",
      "recorded_at": "2026-09-10T06:34:24.972856+00:00",
      "severity": "high",
      "category": "tooling",
      "last_recorded_at": "2026-09-10T06:34:24.972856+00:00",
      "impact": {
        "blocked_minutes": 0,
        "rework_required": false,
        "human_intervention": true,
        "affected_work_units": [
          "WU-6fe0e4521f7a"
        ]
      },
      "work_unit": "WU-6fe0e4521f7a",
      "recurrence_key": "auto:sandbox_implementation:blocked",
      "id": "OBS-1c225c3e25f7",
      "phase": "sandbox_implementation",
      "status": "open",
      "symptom": "[redacted]"
    },
    {
      "constitution_version": "1.4.0",
      "revision": 1,
      "classification": {
        "origin": "framework",
        "confidence": "high"
      },
      "occurrence_count": 1,
      "framework_version": "0.7.0",
      "recorded_at": "2026-09-10T06:36:03.997412+00:00",
      "severity": "high",
      "category": "tooling",
      "last_recorded_at": "2026-09-10T06:36:03.997412+00:00",
      "impact": {
        "blocked_minutes": 0,
        "rework_required": false,
        "human_intervention": true,
        "affected_work_units": [
          "WU-6fe0e4521f7a"
        ]
      },
      "work_unit": "WU-6fe0e4521f7a",
      "recurrence_key": "REC-8a806621bf2b",
      "id": "OBS-d378ad0687a4",
      "phase": "execution",
      "status": "candidate_change",
      "symptom": "[redacted]"
    },
    {
      "constitution_version": "1.4.0",
      "revision": 2,
      "classification": {
        "origin": "framework",
        "confidence": "confirmed"
      },
      "occurrence_count": 1,
      "framework_version": "0.7.0",
      "recorded_at": "2026-09-10T06:40:21.432753+00:00",
      "severity": "high",
      "category": "permissions",
      "last_recorded_at": "2026-09-10T06:40:21.432753+00:00",
      "impact": {
        "blocked_minutes": 15,
        "rework_required": false,
        "human_intervention": true,
        "affected_work_units": [
          "WU-6fe0e4521f7a",
          "WU-2cbd31c47ec7"
        ]
      },
      "work_unit": null,
      "recurrence_key": "REC-5b7d1100ea83",
      "id": "OBS-de4827125707",
      "phase": "execution",
      "status": "resolved",
      "symptom": "[redacted]"
    },
    {
      "constitution_version": "1.4.0",
      "revision": 1,
      "classification": {
        "origin": "framework",
        "confidence": "probable"
      },
      "occurrence_count": 1,
      "framework_version": "0.7.0",
      "recorded_at": "2026-09-10T06:47:04.113084+00:00",
      "severity": "high",
      "category": "tooling",
      "last_recorded_at": "2026-09-10T06:47:04.113084+00:00",
      "impact": {
        "blocked_minutes": 0,
        "rework_required": true,
        "human_intervention": false,
        "affected_work_units": [
          "WU-6fe0e4521f7a"
        ]
      },
      "work_unit": "WU-6fe0e4521f7a",
      "recurrence_key": "auto:sandbox_implementation:timed_out",
      "id": "OBS-3b8a10bf05ca",
      "phase": "sandbox_implementation",
      "status": "open",
      "symptom": "[redacted]"
    },
    {
      "constitution_version": "1.4.0",
      "revision": 1,
      "classification": {
        "origin": "framework",
        "confidence": "probable"
      },
      "occurrence_count": 1,
      "framework_version": "0.7.0",
      "recorded_at": "2026-09-10T06:49:05.456547+00:00",
      "severity": "high",
      "category": "tooling",
      "last_recorded_at": "2026-09-10T06:49:05.456547+00:00",
      "impact": {
        "blocked_minutes": 0,
        "rework_required": true,
        "human_intervention": false,
        "affected_work_units": [
          "WU-2cbd31c47ec7"
        ]
      },
      "work_unit": "WU-2cbd31c47ec7",
      "recurrence_key": "auto:sandbox_implementation:timed_out",
      "id": "OBS-ac96733355c0",
      "phase": "sandbox_implementation",
      "status": "open",
      "symptom": "[redacted]"
    },
    {
      "constitution_version": "1.4.0",
      "revision": 1,
      "classification": {
        "origin": "framework",
        "confidence": "confirmed"
      },
      "occurrence_count": 1,
      "framework_version": "0.7.0",
      "recorded_at": "2026-09-10T19:51:00.853948+00:00",
      "severity": "critical",
      "category": "tooling",
      "last_recorded_at": "2026-09-10T19:51:00.853948+00:00",
      "impact": {
        "blocked_minutes": 720,
        "rework_required": true,
        "human_intervention": true,
        "affected_work_units": [
          "WU-6fe0e4521f7a",
          "WU-2cbd31c47ec7"
        ]
      },
      "work_unit": "WU-6fe0e4521f7a",
      "recurrence_key": "REC-25e25bbc50f4",
      "id": "OBS-f510fdc985ce",
      "phase": "sandbox_implementation",
      "status": "candidate_change",
      "symptom": "[redacted]"
    }
  ],
  "retrospectives": [],
  "executions": [
    {
      "run_id": "RUN-ee62d3413750",
      "duration_ms": 461,
      "ended_at": "2026-09-10T06:34:24.926735+00:00",
      "revision": 2,
      "step": "sandbox_implementation",
      "execution_id": "EXE-e05ccee3617b",
      "work_unit_id": "WU-6fe0e4521f7a",
      "id": "ATTEMPT-dd88f1d1cc55",
      "started_at": "2026-09-10T06:34:24.465668+00:00",
      "status": "blocked",
      "summary": "[redacted]"
    },
    {
      "run_id": "RUN-ee62d3413750",
      "duration_ms": null,
      "ended_at": null,
      "revision": 1,
      "step": "sandbox_implementation",
      "execution_id": "EXE-ab36305e752f",
      "work_unit_id": "WU-6fe0e4521f7a",
      "id": "ATTEMPT-0f07fa534618",
      "started_at": "2026-09-10T06:47:34.549529+00:00",
      "status": "started",
      "summary": "[redacted]"
    },
    {
      "run_id": "RUN-ee62d3413750",
      "duration_ms": 600073,
      "ended_at": "2026-09-10T06:47:04.040811+00:00",
      "revision": 2,
      "step": "sandbox_implementation",
      "execution_id": "EXE-ed35b65b6220",
      "work_unit_id": "WU-6fe0e4521f7a",
      "id": "ATTEMPT-bbe479d51d6d",
      "started_at": "2026-09-10T06:37:03.768375+00:00",
      "status": "timed_out",
      "summary": "[redacted]"
    },
    {
      "run_id": "RUN-ee62d3413750",
      "duration_ms": 600021,
      "ended_at": "2026-09-10T06:49:05.365151+00:00",
      "revision": 2,
      "step": "sandbox_implementation",
      "execution_id": "EXE-cba064e0eb4b",
      "work_unit_id": "WU-2cbd31c47ec7",
      "id": "ATTEMPT-22495f3273ee",
      "started_at": "2026-09-10T06:39:05.013656+00:00",
      "status": "timed_out",
      "summary": "[redacted]"
    }
  ],
  "transmission": {
    "status": "skipped",
    "submitted_at": null,
    "destination": null,
    "ack_id": null,
    "error": null
  }
}
